{
  "name": "PyLadies Amsterdam",
  "city": "Amsterdam",
  "country": "Netherlands",
  "email": "amsterdam@pyladies.com",
  "website": "https://amsterdam.pyladies.com/",
  "social_media": [
    {
      "github": "https://github.com/pyladiesams",
      "linkedin": "https://www.linkedin.com/company/pyladies-amsterdam/",
      "meetup": "https://www.meetup.com/PyLadiesAMS/"
    }
  ]
}
