{
  "name": "PyLadies Vale do Paraíba",
  "city": "Vale do Paraíba",
  "country": "Brazil",
  "email": "vale@pyladies.com",
  "website": "http://vale.pyladies.com",
  "social_media": [
    {
      "github": "pyladiesvale",
      "x": "pyladiesvale",
      "facebook": "pyladiesvale"
    }
  ],
  "lat": -22.5304721,
  "lon": -44.1440705
}
