{
  "name": "PyLadies South Florida",
  "city": "South Florida",
  "country": "USA",
  "email": "southflorida@pyladies.com",
  "social_media": [
    {
      "github": "PyLadiesSoFlo",
      "x": "PyLadiesSoFlo",
      "facebook": "PyLadiesSoFlo",
      "meetup": "PyLadies-SoFlo"
    }
  ],
  "lat": 37.1670484,
  "lon": -94.8463851
}
