{
  "name": "PyLadies Okinawa",
  "city": "Okinawa",
  "country": "Japan",
  "email": "okinawa@pyladies.com",
  "social_media": [
    {
      "x": "PyLadiesOkinawa",
      "github": "PyLadiesOkinawa"
    }
  ],
  "website": "https://pyladies-okinawa.connpass.com",
  "lat": 26.5707754,
  "lon": 128.0255901
}
